{
  "schema_version": 1,
  "profile_version": "example-v1",
  "captured_at": "2000-01-01T00:00:00Z",
  "career_years": 6.0,
  "candidate": {
    "target_roles": ["Applied AI Engineer", "AI Product Engineer"],
    "defensible_level": "senior hands-on individual contributor",
    "degree": "bachelor",
    "proven_strengths": ["production AI systems", "end-to-end product delivery"],
    "known_gaps": ["unsupported claims remain UNKNOWN"]
  },
  "scoring": {
    "model_version": "2026-08-v3",
    "policy_source": "assets/scoring-policy.default.json",
    "weight_method": "owner_policy_provisional",
    "elicited_at": "2000-01-01",
    "rationale": "Replace with a dated owner swing-weighting rationale before treating ranks as calibrated preferences.",
    "match_weights": {
      "mandatory_requirements": 45,
      "task_ownership": 20,
      "production_delivery": 15,
      "preferred_requirements": 8,
      "level_scope": 8,
      "domain_onboarding": 4
    },
    "opportunity_weights": {
      "match_score": 45,
      "finance": 25,
      "location_work_policy": 12,
      "hiring_process": 8,
      "compensation_level": 10
    },
    "match_values": {"confirmed": 100, "transferable": 55, "missing": 0, "unknown": 0},
    "axis_values": {
      "finance": {"A": 100, "B": 75, "C": 35, "D": 0, "UNVERIFIED": 0},
      "location_work_policy": {"good": 100, "acceptable": 65, "poor": 20, "unknown": 0},
      "hiring_process": {"F0": 100, "F1": 80, "F2": 55, "F3": 20, "UNKNOWN": 0},
      "compensation_level": {"good": 100, "acceptable": 65, "poor": 20, "unknown": 0}
    },
    "confidence_threshold": 70,
    "sensitivity_profiles": {
      "fit_first": {"match_score": 60, "finance": 15, "location_work_policy": 8, "hiring_process": 7, "compensation_level": 10},
      "stability_first": {"match_score": 35, "finance": 35, "location_work_policy": 10, "hiring_process": 8, "compensation_level": 12},
      "low_friction": {"match_score": 40, "finance": 20, "location_work_policy": 15, "hiring_process": 15, "compensation_level": 10}
    }
  },
  "preferences": {
    "hard_exclusions": ["user-defined excluded domains"],
    "finance_policy": "avoid established chronic-loss employers",
    "hiring_effort_max": "F2",
    "hands_on_lead_allowed": true,
    "location_anchor": "user-defined transit anchor",
    "commute_tiers": [
      {"grade": "T1", "rule": "direct or short commute"},
      {"grade": "T2", "rule": "acceptable commute"},
      {"grade": "T3", "rule": "long commute"}
    ]
  },
  "resume": {
    "source_files": [],
    "ordering": ["summary", "reverse-chronological experience", "skills", "education"],
    "commitment_statement": "user-confirmed statement or UNKNOWN"
  }
}
